{
  "descritor": {
    "municipio": 7107,
    "entidade": 10048,
	"adesaoParticipacao": true,
	"gerenciadoraJurisdicionada": false,
	"cnpjGerenciadora": "01234567890123",
    "codigoEdital": "123",
	"codigoContrato": "202304567",
    "retificacao": false
  },
  "fonteRecursosContratacao": [8, 91],
  "itens": [1,2,4],
  "tipoContratoId": 1,
  "numeroContratoEmpenho": "1",
  "anoContrato": 2021,
  "processo": "1/2021",
  "categoriaProcessoId": 2,
  "receita": false,
  "despesas": ["31234567", "12345678"],
  "codigoUnidade": "1",
  "niFornecedor": "10000000000010",
  "tipoPessoaFornecedor": "PJ",
  "nomeRazaoSocialFornecedor": "Fornecedor do Teste I",
  "niFornecedorSubContratado": "10000000000011",
  "tipoPessoaFornecedorSubContratado": "PE",
  "nomeRazaoSocialFornecedorSubContratado": "Fornecedor Subcontratado do Teste I",
  "objetoContrato": "Contrato para exemplificar uso da API PNCP.",
  "informacaoComplementar": "",
  "valorInicial": 10000.0000,
  "numeroParcelas": 2,
  "valorParcela": 5000.0000,
  "valorGlobal": 10000.0000,
  "valorAcumulado": 10000.0000,
  "dataAssinatura": "2021-07-27",
  "dataVigenciaInicio": "2021-07-28",
  "dataVigenciaFim": "2021-07-29",
  "tipoObjetoContrato": 1
}